Key,app_af,app_am,app_ar,app_ar_AE,app_ar_DZ,app_ar_EG,app_az,app_bg,app_bn,app_bn_IN,app_ca,app_cs,app_da,app_de,app_de_AT,app_de_CH,app_el,app_en,app_en_AU,app_en_CA,app_en_GB,app_en_IN,app_es,app_es_AR,app_es_CO,app_es_MX,app_et,app_fa,app_fi,app_fr,app_fr_BE,app_fr_CA,app_fr_CH,app_gl,app_gu,app_he,app_hi,app_hr,app_hu,app_id,app_it,app_ja,app_kk,app_ko,app_lt,app_lv,app_ml,app_mn,app_mr,app_ms,app_ms_SG,app_my,app_nb,app_ne,app_nl,app_nl_BE,app_pl,app_pt,app_pt_PT,app_ro,app_ru,app_ru_KZ,app_ru_UA,app_si,app_sk,app_sl,app_sr,app_sv,app_sw,app_ta,app_te,app_th,app_tl,app_tr,app_uk,app_ur,app_ur_IN,app_uz,app_vi,app_zh,app_zh_CN,app_zh_HK,app_zh_MO,app_zh_SG
close,Sluit,ዝጋ,إغلاق,إغلاق,إغلاق,إغلاق,Bağla,Затвори,বন্ধ করুন,বন্ধ করুন,Tancar,Zavřít,Luk,Schließen,Schließen,Schliessen,Κλείσιμο,Close,Close,Close,Close,Close,Cerrar,Cerrar,Cerrar,Cerrar,Sulge,بستن,Sulje,Fermer,Fermer,Fermer,Fermer,Pechar,બંધ કરો,סגור,बंद करें,Zatvori,Bezárás,Tutup,Chiudi,閉じる,Жабу,닫기,Uždaryti,Aizvērt,അടയ്ക്കുക,Хаах,बंद करा,Tutup,Tutup,ပိတ်ရန်,Lukk,बन्द गर्नुहोस्,Sluiten,Sluiten,Zamknij,Fechar,Fechar,Închide,Закрыть,Закрыть,Закрыть,වසන්න,Zatvoriť,Zapri,Затвори,Stäng,Funga,மூடு,మూసివేయి,ปิด,Isara,Kapat,Закрити,بند کریں,بند کریں,Yopish,Đóng,關閉,关闭,關閉,關閉,关闭
error_content,"'n Onverwagse fout het voorgekom. Probeer asseblief later weer.","የማይጠበቅ ስህተት ተከስቷል። እባክዎ ቆይተው እንደገና ይሞክሩ።","حدث خطأ غير متوقع. يرجى المحاولة مرة أخرى لاحقاً.","حدث خطأ غير متوقع. يرجى المحاولة مرة أخرى لاحقاً.","حدث خطأ غير متوقع. يرجى المحاولة مرة أخرى لاحقاً.","حدث خطأ غير متوقع. يرجى المحاولة مرة أخرى لاحقاً.","Gözlənilməz xəta baş verdi. Zəhmət olmasa, bir az sonra yenidən cəhd edin.","Възникна неочаквана грешка. Моля, опитайте отново по-късно.","একটি অপ্রত্যাশিত ত্রুটি ঘটেছে। অনুগ্রহ করে পরে আবার চেষ্টা করুন।","একটি অপ্রত্যাশিত ত্রুটি ঘটেছে। অনুগ্রহ করে পরে আবার চেষ্টা করুন।","S'ha produït un error inesperat. Si us plau, torneu-ho a provar més tard.","Došlo k neočekávané chybě. Zkuste to prosím později znovu.","Der opstod en uventet fejl. Prøv igen senere.","Ein unerwarteter Fehler ist aufgetreten. Bitte versuchen Sie es später erneut.","Ein unerwarteter Fehler ist aufgetreten. Bitte versuchen Sie es später erneut.","Ein unerwarteter Fehler ist aufgetreten. Bitte versuchen Sie es später erneut.","Παρουσιάστηκε ένα απρόσμενο σφάλμα. Παρακαλώ δοκιμάστε ξανά αργότερα.","An unexpected error occurred. Please try again later.","An unexpected error occurred. Please try again later.","An unexpected error occurred. Please try again later.","An unexpected error occurred. Please try again later.","An unexpected error occurred. Please try again later.","Ocurrió un error inesperado. Por favor, inténtalo de nuevo más tarde.","Ocurrió un error inesperado. Por favor, intentá de nuevo más tarde.","Ocurrió un error inesperado. Por favor, inténtalo de nuevo más tarde.","Ocurrió un error inesperado. Por favor, inténtalo de nuevo más tarde.","Ilmnes ootamatu viga. Palun proovige hiljem uuesti.","یک خطای غیرمنتظره رخ داد. لطفاً بعداً دوباره تلاش کنید.","Tapahtui odottamaton virhe. Yritä myöhemmin uudelleen.","Une erreur inattendue s'est produite. Veuillez réessayer plus tard.","Une erreur inattendue s'est produite. Veuillez réessayer plus tard.","Une erreur inattendue s'est produite. Veuillez réessayer plus tard.","Une erreur inattendue s'est produite. Veuillez réessayer plus tard.","Ocorreu un erro inesperado. Téntao de novo máis tarde.","એક અનપેક્ષિત ભૂલ આવી. કૃપા કરીને પછી ફરી પ્રયાસ કરો.","אירעה שגיאה בלתי צפויה. אנא נסה שוב מאוחר יותר.","एक अप्रत्याशित त्रुटि हुई। कृपया बाद में पुनः प्रयास करें।","Došlo je do neočekivane pogreške. Molimo pokušajte ponovo kasnije.","Váratlan hiba történt. Kérjük, próbálja újra később.","Terjadi kesalahan yang tidak terduga. Silakan coba lagi nanti.","Si è verificato un errore imprevisto. Riprova più tardi.","予期せぬエラーが発生しました。後でもう一度お試しください。","Күтпеген қате орын алды. Кейінірек қайталап көріңіз.","예기치 않은 오류가 발생했습니다. 나중에 다시 시도해주세요.","Įvyko netikėta klaida. Bandykite dar kartą vėliau.","Notika neparedzēta kļūda. Lūdzu, mēģiniet vēlāk.","അപ്രതീക്ഷിതമായ ഒരു പിശക് സംഭവിച്ചു. ദയവായി പിന്നീട് വീണ്ടും ശ്രമിക്കുക.","Гэнэтийн алдаа гарлаа. Дараа дахин оролдоно уу.","अनपेक्षित त्रुटी आली. कृपया नंतर पुन्हा प्रयत्न करा.","Ralat tidak dijangka telah berlaku. Sila cuba lagi nanti.","Ralat tidak dijangka telah berlaku. Sila cuba lagi nanti.","မမျှော်လင့်ထားသော အမှားတစ်ခု ဖြစ်ပွားခဲ့သည်။ ကျေးဇူးပြု၍ နောက်မှ ထပ်မံကြိုးစားပါ။","Det oppstod en uventet feil. Prøv igjen senere.","अनपेक्षित त्रुटि भयो। कृपया पछि फेरि प्रयास गर्नुहोस्।","Er is een onverwachte fout opgetreden. Probeer het later opnieuw.","Er is een onverwachte fout opgetreden. Probeer het later opnieuw.","Wystąpił nieoczekiwany błąd. Spróbuj ponownie później.","Ocorreu um erro inesperado. Por favor, tente novamente mais tarde.","Ocorreu um erro inesperado. Por favor, tente novamente mais tarde.","A apărut o eroare neașteptată. Vă rugăm să încercați din nou mai târziu.","Произошла непредвиденная ошибка. Пожалуйста, попробуйте снова позже.","Произошла непредвиденная ошибка. Пожалуйста, попробуйте снова позже.","Произошла непредвиденная ошибка. Пожалуйста, попробуйте снова позже.","අනපේක්ෂිත දෝෂයක් සිදුවිය. කරුණාකර පසුව නැවත උත්සාහ කරන්න.","Vyskytla sa neočakávaná chyba. Skúste to prosím neskôr.","Prišlo je do nepričakovane napake. Poskusite znova pozneje.","Догодила се неочекивана грешка. Молимо покушајте поново касније.","Ett oväntat fel inträffade. Försök igen senare.","Hitilafu isiyotarajiwa imetokea. Tafadhali jaribu tena baadaye.","எதிர்பாராத பிழை ஏற்பட்டது. தயவுசெய்து பின்னர் மீண்டும் முயற்சிக்கவும்.","ఊహించని లోపం సంభవించింది. దయచేసి తర్వాత మళ్లీ ప్రయత్నించండి.","เกิดข้อผิดพลาดที่ไม่คาดคิด โปรดลองใหม่อีกครั้งในภายหลัง","Mayroong hindi inaasahang error na nangyari. Pakisubukan ulit mamaya.","Beklenmeyen bir hata oluştu. Lütfen daha sonra tekrar deneyin.","Сталася неочікувана помилка. Будь ласка, спробуйте ще раз пізніше.","ایک غیر متوقع خرابی پیش آئی۔ براہ کرم بعد میں دوبارہ کوشش کریں۔","ایک غیر متوقع خرابی پیش آئی۔ براہ کرم بعد میں دوبارہ کوشش کریں۔","Kutilmagan xatolik yuz berdi. Iltimos, keyinroq qayta urinib ko'ring.","Đã xảy ra lỗi không mong muốn. Vui lòng thử lại sau.","發生了意外錯誤。請稍後再試。","发生了意外错误。请稍后重试。","發生了意外錯誤。請稍後再試。","發生了意外錯誤。請稍後再試。","发生了意外错误。请稍后重试。"
error_oops,"Oeps, iets het verkeerd gegaan",ይቅርታ፣ የሆነ ስህተት ተከስቷል,عفواً، حدث خطأ ما,عفواً، حدث خطأ ما,عفواً، حدث خطأ ما,عفواً، حدث خطأ ما,"Ups, nəsə səhv getdi","Опа, нещо се обърка","উফ, কিছু একটা ভুল হয়েছে","ওহো, কিছু একটা ভুল হয়েছে","Vaja, alguna cosa ha anat malament","Jejda, něco se pokazilo","Ups, noget gik galt","Hoppla, etwas ist schiefgelaufen","Hoppla, etwas ist schiefgelaufen","Hoppla, etwas ist schiefgelaufen","Ωχ, κάτι πήγε στραβά","Oops, something went wrong","Oops, something went wrong","Oops, something went wrong","Oops, something went wrong","Oops, something went wrong","Ups, algo salió mal","Ups, algo salió mal","Ups, algo salió mal","Ups, algo salió mal","Ups, midagi läks valesti",اوه، مشکلی پیش آمد,"Hups, jokin meni pieleen","Oups, quelque chose s'est mal passé","Oups, quelque chose s'est mal passé","Oups, quelque chose s'est mal passé","Oups, quelque chose s'est mal passé","Vaia, algo saíu mal","અરે, કંઈક ખોટું થયું","אופס, משהו השתבש","उफ़, कुछ गलत हो गया","Ups, nešto je pošlo po krivu","Hoppá, valami hiba történt","Ups, terjadi kesalahan","Ops, qualcosa è andato storto",おっと、問題が発生しました,"Ойбай, бір нәрсе дұрыс болмады","앗, 문제가 발생했습니다","Oi, kažkas nutiko","Ak vai, kaut kas nogāja greizi","അയ്യോ, എന്തോ തെറ്റ് സംഭവിച്ചു","Өө, ямар нэгэн зүйл буруу болсон","अरेरे, काहीतरी चूक झाली","Alamak, ada sesuatu yang tidak kena","Alamak, ada sesuatu yang tidak betul",အို၊ တစ်ခုခုမှားယွင်းသွားပါပြီ,"Ups, noe gikk galt","उफ्, केही गलत भयो","Oeps, er is iets misgegaan","Oeps, er is iets misgelopen","Ups, coś poszło nie tak","Ops, algo deu errado","Ups, algo correu mal","Ups, ceva nu a funcționat","Упс, что-то пошло не так","Упс, что-то пошло не так","Упс, что-то пошло не так","අයියෝ, යමක් වැරදී ඇත","Ups, niečo sa pokazilo","Ups, nekaj je šlo narobe","Упс, нешто је пошло наопако","Hoppsan, något gick fel","Samahani, kuna hitilafu imetokea","அடடா, ஏதோ தவறு நடந்துவிட்டது","అయ్యో, ఏదో తప్పు జరిగింది",อุปส์ มีบางอย่างผิดพลาด,"Oops, may mali na nangyari","Hata, bir şeyler yanlış gitti","Упс, щось пішло не так",افسوس، کچھ غلط ہو گیا,افسوس، کچھ غلط ہو گیا,"Voy, xatolik yuz berdi","Rất tiếc, đã xảy ra lỗi",糟糕，出了點問題,糟糕，出错了,哎呀，出錯了,哎呀，出錯了,哎呀，出错了
error_report,"Help ons verbeteren door 'n anonieme verslag te stuur","ለማሻሻል እንድንችል ስም አልባ ሪፖርት በመላክ ያግዙን","ساعدنا في التحسين عن طريق إرسال تقرير مجهول","ساعدنا في التحسين عن طريق إرسال تقرير مجهول","ساعدنا في التحسين عن طريق إرسال تقرير مجهول","ساعدنا في التحسين عن طريق إرسال تقرير مجهول","Anonim hesabat göndərərək bizə təkmilləşməyə kömək edin","Помогнете ни да се подобрим, като изпратите анонимен доклад","একটি অজ্ঞাত রিপোর্ট পাঠিয়ে আমাদের উন্নত করতে সাহায্য করুন","একটি অজ্ঞাত রিপোর্ট পাঠিয়ে আমাদের উন্নত করতে সাহায্য করুন","Ajudeu-nos a millorar enviant un informe anònim","Pomozte nám zlepšit se zasláním anonymní zprávy","Hjælp os med at forbedre ved at sende en anonym rapport","Helfen Sie uns zu verbessern, indem Sie einen anonymen Bericht senden","Helfen Sie uns zu verbessern, indem Sie einen anonymen Bericht senden","Helfen Sie uns zu verbessern, indem Sie einen anonymen Bericht senden","Βοηθήστε μας να βελτιωθούμε στέλνοντας μια ανώνυμη αναφορά","Help us improve by sending an anonymous report","Help us improve by sending an anonymous report","Help us improve by sending an anonymous report","Help us improve by sending an anonymous report","Help us improve by sending an anonymous report","Ayúdanos a mejorar enviando un informe anónimo","Ayudanos a mejorar enviando un reporte anónimo","Ayúdanos a mejorar enviando un informe anónimo","Ayúdanos a mejorar enviando un reporte anónimo","Aita meil paremaks saada, saates anonüümse aruande","با ارسال گزارش ناشناس به بهبود ما کمک کنید","Auta meitä parantamaan lähettämällä anonyymi raportti","Aidez-nous à nous améliorer en envoyant un rapport anonyme","Aidez-nous à nous améliorer en envoyant un rapport anonyme","Aidez-nous à améliorer en envoyant un rapport anonyme","Aidez-nous à nous améliorer en envoyant un rapport anonyme","Axúdanos a mellorar enviando un informe anónimo","અનામી રિપોર્ટ મોકલીને અમને સુધારવામાં મદદ કરો","עזרו לנו להשתפר על ידי שליחת דוח אנונימי","एक अज्ञात रिपोर्ट भेजकर हमें बेहतर बनाने में मदद करें","Pomozite nam da se poboljšamo slanjem anonimne prijave","Segítsen fejleszteni egy névtelen jelentés küldésével","Bantu kami berkembang dengan mengirim laporan anonim","Aiutaci a migliorare inviando un rapporto anonimo","匿名レポートを送信して改善にご協力ください","Анонимді есеп жіберу арқылы жақсартуға көмектесіңіз","익명 보고서를 보내 개선에 도움을 주세요","Padėkite mums tobulėti siųsdami anoniminę ataskaitą","Palīdziet mums uzlaboties, nosūtot anonīmu ziņojumu","അജ്ഞാത റിപ്പോർട്ട് അയച്ച് മെച്ചപ്പെടുത്താൻ ഞങ്ങളെ സഹായിക്കുക","Нэрээ нууцалсан тайлан илгээж сайжруулахад тусалаарай","अज्ञात अहवाल पाठवून आम्हाला सुधारण्यास मदत करा","Bantu kami bertambah baik dengan menghantar laporan tanpa nama","Bantu kami bertambah baik dengan menghantar laporan tanpa nama","အမည်မသိ အစီရင်ခံစာ ပို့ခြင်းဖြင့် ကျွန်ုပ်တို့အား တိုးတက်စေရန် ကူညီပါ","Hjelp oss å bli bedre ved å sende en anonym rapport","बेनामी रिपोर्ट पठाएर हामीलाई सुधार गर्न मद्दत गर्नुहोस्","Help ons verbeteren door een anoniem rapport te sturen","Help ons verbeteren door een anoniem rapport te sturen","Pomóż nam się poprawić, wysyłając anonimowy raport","Ajude-nos a melhorar enviando um relatório anônimo","Ajude-nos a melhorar enviando um relatório anónimo","Ajutați-ne să ne îmbunătățim trimițând un raport anonim","Помогите нам улучшиться, отправив анонимный отчет","Помогите нам улучшиться, отправив анонимный отчет","Помогите нам улучшиться, отправив анонимный отчет","නිර්නාමික වාර්තාවක් එවීමෙන් අපට වැඩිදියුණු වීමට උදව් කරන්න","Pomôžte nám zlepšiť sa zaslaním anonymnej správy","Pomagajte nam izboljšati z anonimnim poročilom","Помозите нам да се побољшамо слањем анонимне пријаве","Hjälp oss förbättra genom att skicka en anonym rapport","Tusaidie kuboresha kwa kutuma ripoti ya siri","அநாமதேய அறிக்கை அனுப்பி எங்களை மேம்படுத்த உதவுங்கள்","అజ్ఞాత నివేదిక పంపడం ద్వారా మెరుగుపరచడంలో మాకు సహాయపడండి","ช่วยให้เราปรับปรุงโดยส่งรายงานแบบไม่ระบุตัวตน","Tulungang mapabuti kami sa pamamagitan ng pagpapadala ng anonymous na ulat","Anonim rapor göndererek gelişmemize yardımcı olun","Допоможіть нам покращитися, надіславши анонімний звіт","گمنام رپورٹ بھیج کر ہمیں بہتر بنانے میں مدد کریں","گمنام رپورٹ بھیج کر ہمیں بہتر بنانے میں مدد کریں","Anonim hisobot yuborish orqali yaxshilashimizga yordam bering","Giúp chúng tôi cải thiện bằng cách gửi báo cáo ẩn danh","發送匿名報告幫助我們改進","发送匿名报告帮助我们改进","發送匿名報告幫助我們改進","發送匿名報告幫助我們改進","发送匿名报告帮助我们改进"
language,Stelsel Taal,የስርዓት ቋንቋ,لغة النظام,لغة النظام,لغة النظام,لغة النظام,Sistem Dili,Език на системата,সিস্টেম ভাষা,সিস্টেম ভাষা,Idioma del sistema,Systémový jazyk,Systemsprog,Systemsprache,Systemsprache,Systemsprache,Γλώσσα συστήματος,System Language,System Language,System Language,System Language,System Language,Idioma del sistema,Idioma del sistema,Idioma del sistema,Idioma del sistema,Süsteemi keel,زبان سیستم,Järjestelmän kieli,Langue du système,Langue du système,Langue du système,Langue du système,Idioma do sistema,સિસ્ટમ ભાષા,שפת מערכת,सिस्टम भाषा,Sistemski jezik,Rendszer nyelve,Bahasa Sistem,Lingua di sistema,システム言語,Жүйе тілі,시스템 언어,Sistemos kalba,Sistēmas valoda,സിസ്റ്റം ഭാഷ,Системийн хэл,प्रणाली भाषा,Bahasa Sistem,Bahasa Sistem,စစ်စဉ်ဘာသာ,Systemspråk,प्रणाली भाषा,Systeemtaal,Systeemtaal,Język systemu,Língua do sistema,Língua do sistema,Limba sistemului,Язык системы,Мова системи,Системски језик,පද්ධති භාෂාව,Systémový jazyk,Sistemski jezik,Језик система,Systemspråk,Lugha ya Mfumo,கணினி மொழி,సిస్టం భాష,ภาษาระบบ,Wika ng sistema,Sistem Dili,Мова системи,نظام کی زبان,نظام کی زبان,Tizim tili,Ngôn ngữ hệ thống,系統語言,系统语言,系統語言,系統語言,系統語言
